### ISSUE TITLE
Rosenpass keys seem to be incompatible between versions

### ISSUE THREAD

**Issue by bgrasmo** [rosenpass/rosenpass#599]
It seems the rosenpass keys created with v0.2.2 is not compatible with latest build from main, v0.3.0 and vice versa. I think this might be the reason I can't get a v0.2.2 server and a v0.3.0 client connected. In short, keys created with v0.2.2 does not load using the v0.3.0 binary and keys created using v0.3.0 does not load using the v0.2.2 binary of rosenpass.

Error message shown from v0.2.2 binary trying to load a secret key created with v0.3.0:
```
./rosenpass-v022 exchange-config v022-config
[2025-02-06T17:43:30Z ERROR rosenpass] Could not load file "serverA-v030-secret"
```
And similar from v0.3.0 binary trying to load a secret key created with v0.2.2:
```
./rosenpass-v030 exchange-config v030-config
[2025-02-06T18:06:20Z ERROR rosenpass] could not load public-key file "serverB-v022-secret": invalid key
```
It looks like there is another issue with it calling the secret key the public-key.

To confirm it is a key issue I've built both v0.2.2 and v0.3.0 on two Ubuntu 24.04.1 machines, serverA and serverB. To first check that everything is working, and it isn't a network or firewall issues, I used v0.2.2 on both and configured serverA to initialize key exchange with serverB, which worked as expected.
```
./rosenpass-v022 gen-config v022-config
# Modify config and then create keys:
./rosenpass-v022 gen-keys v022-config
```
Starting both with `./rosenpass-v022 exchange-config v022-config` they exchange keys. Tcpdump as seen from serverA:
```
16:50:32.239556 IP serverAIP.53138 > serverBIP.9999: UDP, length 1092
16:50:32.244801 IP serverBIP.9999 > serverAIP.53138: UDP, length 1132
16:50:32.246793 IP serverAIP.53138 > serverBIP.9999: UDP, length 176
16:50:32.248558 IP serverBIP.9999 > serverAIP.53138: UDP, length 64
```
Switching config so serverB initializes key exchange with serverA also works, so connection between servers is working as expected.

I then stopped the service on both servers, used the v0.3.0 binary on serverB to load the v0.2.2 keys but that failed with the `invalid key` message. I generated new v0.3.0 keys on serverB, transferred the new public key to serverA, updated its config and started the service on both servers. Now serverA does not respond to the key exchange request. It did not show any errors of not loading the v0.3.0 public key from serverB, but seems to just ignore the requests:

```
17:11:46.912556 IP serverBIP.39694 > serverAIP.9999: UDP, length 1060
17:11:47.266133 IP serverBIP.39694 > serverAIP.9999: UDP, length 1060
17:11:47.986104 IP serverBIP.39694 > serverAIP.9999: UDP, length 1060
17:11:49.421774 IP serverBIP.39694 > serverAIP.9999: UDP, length 1060
17:11:52.455093 IP serverBIP.39694 > serverAIP.9999: UDP, length 1060
17:11:59.776625 IP serverBIP.39694 > serverAIP.9999: UDP, length 1060
```

Using v0.3.0 on both servers work as expected:
```
17:37:23.394637 IP serverAIP.42082 > serverBIP.9999: UDP, length 1060
17:37:23.399887 IP serverBIP.9999 > serverAIP.42082: UDP, length 1100
17:37:23.400844 IP serverAIP.42082 > serverBIP.9999: UDP, length 176
17:37:23.402511 IP serverBIP.9999 > serverAIP.42082: UDP, length 64
```

**Comment by ilka-schulz** [comment]
Thanks for opening the issue! Just for clarification: the `main` branch is our development branch and the latest release is `v0.2.2` on the `v0.2.x` stable branch. The `v0.3.0` is currently only in planning, not yet released. However, this is an important issue to fix before we can release `v0.3.0`. I will mark this issue as a blocker for the release.

### Definition of Done
- [ ] write a Nix integration test to run against the current stable release to test compatibility (might already be implemented?)
- [ ] write documentation for that test
